{"case_version":"1.0.0","catalog_version":"0.1.0","certification_claims":["B-1%"],"content_hash":"6dd008b26348fc536f48f1dde7a3b7ecab472bb26e5e6246b488900e58f5838d","criteria_results":[{"detail":"parity self-check (no pinned reference loaded)","gating":true,"id":"peak_depth","metric":"relative_peak","observed":0.0,"passed":true,"threshold":{"op":"abs<=","units":"%","value":1.0},"variable":"h"},{"detail":"parity self-check (no pinned reference loaded)","gating":true,"id":"volume","metric":"relative_volume","observed":0.0,"passed":true,"threshold":{"op":"abs<=","units":"%","value":1.0},"variable":"volume"}],"passed":true,"schema_version":"1.0.0","signature":{"alg":"Ed25519","key_id":"hydrobench-dev","value":"TSkuhdDqKhYbHqUaf+gh/WFO+7rHGotCMjE9EuE2sfGDky/6qzpE1QsZt9AICoo7p2a6gtMrq3PZ4h5ykZ1ACQ=="},"solver":{"adapter":"swmm5","name":"SWMM","version":"5.2.4"},"test_id":"B-EXTRAN-001_extran_parity","timestamp":"2024-01-01T00:00:00Z","track":"B"}
