{"case_version":"1.0.0","catalog_version":"0.1.0","certification_claims":["A-V"],"content_hash":"52185787625f56a510b8fb66fcdfb0ac861eb7a4be86c180a65d24ad1ea94870","criteria_results":[{"gating":true,"id":"profile_depth","metric":"Linf","observed":0.0037413348655662704,"passed":true,"threshold":{"op":"abs<=","units":"m","value":0.02},"variable":"h"},{"detail":"L2 error relative to the L2 norm of the reference","gating":true,"id":"pipe_flow","metric":"L2","observed":4.095937439580723e-06,"passed":true,"threshold":{"op":"abs<=","units":"%","value":0.5},"variable":"Q"}],"passed":true,"schema_version":"1.0.0","signature":{"alg":"Ed25519","key_id":"benchmark1d2d-dev","value":"GyzUPATmhHNzXaDHVAD8/ZvCYh3/2S1g1bK3kpgGAsalqP8rPWUJNBYKCxic12ise5J4GZ6O+AKBajYM3aIWCg=="},"solver":{"adapter":"swmm (FV routing, network.json as a SWMM input file)","name":"OpenSWMM Engine v6 finite volume (6.0.0a4.dev1)","version":"6.0.0a4.dev1"},"test_id":"A1D-005_backwater_through_manholes","timestamp":"2024-01-01T00:00:00Z","track":"A"}
