{"case_version":"2.0.0","catalog_version":"0.1.0","certification_claims":[],"content_hash":"0dedc36029c5df1ce6929e9402405a481f7f511c224e378d5029481307a63f7e","convergence_result":{"errors":[0.001387164967251426,0.0023327310390112528,0.0037929737054301473,0.005398729689589826],"expected_order":1.0,"gci":1.3036871518189312,"min_observed_order":0.8,"norm":"L1","observed_order":0.7255950006456373,"passed":false,"spacings":[1.25,2.5,5.0,10.0],"variable":"h"},"criteria_results":[{"detail":"front holding the last 5% of the water downstream of the dam: 1234.06 m vs exact 1237.39 m","gating":true,"id":"volume_front","metric":"volume_front_error","observed":-3.3263556530341702,"passed":false,"threshold":{"op":"abs<=","units":"m","value":2.5},"variable":"h"},{"gating":false,"id":"front_position","metric":"front_position_error","observed":44.89785438002309,"passed":false,"threshold":{"op":"abs<=","units":"m","value":2.5},"variable":"h"},{"gating":true,"id":"mass","metric":"global_mass_error","observed":0.003041857933488933,"passed":true,"threshold":{"op":"abs<=","units":"%","value":0.1},"variable":"volume"}],"passed":false,"schema_version":"1.0.0","signature":{"alg":"Ed25519","key_id":"benchmark1d2d-dev","value":"RQ0lMTZwVmYhuoNzKeMh7/5t706IXzCCzz4DZX82nh9YkDhTRR6BdnCy2hxkeaLUIFHooZX1pQlG4FXsvjheAQ=="},"solver":{"adapter":"swmm (FV routing, conduit per grid cell)","name":"OpenSWMM Engine v6 finite volume (6.0.0a4.dev1)","version":"6.0.0a4.dev1"},"test_id":"A1F-010_ritter_dry_bed_dambreak","timestamp":"2024-01-01T00:00:00Z","track":"A"}
