{"case_version":"1.0.0","catalog_version":"0.1.0","certification_claims":["A-V"],"content_hash":"bbe263827505eab5e6e441f6e561b95bca50e2952075476acca222ca58343204","convergence_result":{"expected_order":1.0,"gci":1.0056606756846977,"min_observed_order":0.8,"norm":"L1","observed_order":1.9474100715824543,"passed":true,"variable":"h"},"criteria_results":[{"gating":true,"id":"L1_h","metric":"L1","observed":0.00038832993202398807,"passed":true,"threshold":{"op":"abs<=","units":"m","value":0.05},"variable":"h"},{"gating":true,"id":"mass","metric":"global_mass_error","observed":-0.01599318170623032,"passed":true,"threshold":{"op":"abs<=","units":"%","value":0.1},"variable":"volume"}],"passed":true,"schema_version":"1.0.0","signature":{"alg":"Ed25519","key_id":"hydrobench-dev","value":"Hc747mcwlwP7N4JXMLPEas8aJnTF+DMMqbhqenRmTA9okC/f1VeF5SQIYgz7Kt+a7yo1UZw9jg/cD15mcKO+DQ=="},"solver":{"adapter":"generic_parquet","name":"demo","version":"0.1.0"},"test_id":"A1F-011_stoker_wet_bed_dambreak","timestamp":"2024-01-01T00:00:00Z","track":"A"}
