{"case_version":"2.0.0","catalog_version":"0.1.0","certification_claims":[],"content_hash":"0660d1be60fd290766a1935d56fcd7218de11e002ef0242160475840d611c1c0","convergence_result":{"errors":[0.010357268627121451,0.02020239513770152,0.037963032204179924,0.06702573310542624],"expected_order":1.0,"gci":1.2992634545086976,"min_observed_order":0.8,"norm":"L1","observed_order":0.9369758183192238,"passed":true,"spacings":[0.25,0.5,1.0,2.0],"variable":"h"},"criteria_results":[{"gating":true,"id":"depth_L1","metric":"L1","observed":0.010357268627121451,"passed":true,"threshold":{"op":"abs<=","units":"m","value":0.05},"variable":"h"},{"gating":true,"id":"mass","metric":"global_mass_error","observed":0.14868666180429327,"passed":false,"threshold":{"op":"abs<=","units":"%","value":0.1},"variable":"volume"}],"passed":false,"schema_version":"1.0.0","signature":{"alg":"Ed25519","key_id":"benchmark1d2d-dev","value":"VdP4jO/LDzcREsJ/tdpabkEyWlnTWp70A5E3xUJkIpDgvNvYUImeGGSoNlkc2z/bVUaSwj5lb83GPnamRA5JBQ=="},"solver":{"adapter":"telemac2d (Selafin, centreline nodes); HLLC scheme (the default kinetic scheme is unstable here)","name":"openTELEMAC-2D v9.1.1","version":"v9.1.1"},"test_id":"A2A-020_oblique_hydraulic_jump","timestamp":"2024-01-01T00:00:00Z","track":"A"}
