{"case_version":"1.0.0","catalog_version":"0.1.0","certification_claims":["A-C"],"content_hash":"00d54bfe7661ba162ffc572bc2f9a0519ce79d3e719aa25ad2f57885f9c02c10","criteria_results":[{"detail":"final_stored_volume: simulated 97200 vs expected 97200 m3","gating":true,"id":"mass_conservation","metric":"expected_state_error","observed":-2.152016491486898e-05,"passed":true,"threshold":{"op":"abs<=","units":"%","value":0.1},"variable":"volume"}],"passed":true,"schema_version":"1.0.0","signature":{"alg":"Ed25519","key_id":"benchmark1d2d-dev","value":"I0kzWWhPtLDMTEmjbjNPuYhkk7RQQ1K2k6CV2eI1XiCsulebat35ixKhSh6LbRFwAmO2RJHwRcCVo/l4qahJBw=="},"solver":{"adapter":"generic_parquet","name":"demo-swe2d (first-order FV, HLL + hydrostatic reconstruction)","version":"0.1.0"},"test_id":"A2C-EA2_floodplain_depressions","timestamp":"2024-01-01T00:00:00Z","track":"A"}
