{"case_version":"1.0.0","catalog_version":"0.1.0","certification_claims":["A-C"],"content_hash":"11af2204c22135a1e60633084d939efcb6f587c0f943b16871bd5e884c9edc0e","criteria_results":[{"detail":"pond_final_level_p1: simulated 10.2542 vs expected 10.25 m","gating":true,"id":"final_level_p1","metric":"expected_state_error","observed":0.004210890000003076,"passed":true,"threshold":{"op":"abs<=","units":"m","value":0.02},"variable":"h"},{"detail":"pond_final_level_p2: simulated 10.2542 vs expected 10.25 m","gating":true,"id":"final_level_p2","metric":"expected_state_error","observed":0.004210829999996335,"passed":true,"threshold":{"op":"abs<=","units":"m","value":0.02},"variable":"h"},{"detail":"peak_level: simulated 10.3505 vs expected 10.35 m","gating":true,"id":"peak_level","metric":"expected_state_error","observed":0.0004985200000042767,"passed":true,"threshold":{"op":"abs<=","units":"m","value":0.02},"variable":"h"},{"detail":"final_stored_volume: simulated 10207.7 vs expected 9954.1 m3","gating":false,"id":"final_volume","metric":"expected_state_error","observed":2.5477749670989795,"passed":false,"threshold":{"op":"abs<=","units":"%","value":2.0},"variable":"volume"}],"passed":true,"schema_version":"1.0.0","signature":{"alg":"Ed25519","key_id":"benchmark1d2d-dev","value":"oDz+Sh/DUM0xU5Bxeun0q4+y4k7TNlwqiYmaxrL86mreJrHkPM6BxLF9MMOoQANW1kG5jv+4ITOfEyjF9+U+CA=="},"solver":{"adapter":"lisflood (dg2 solver, defaults; CPU, double precision)","name":"LISFLOOD-FP 8.3 DG2","version":"8.3"},"test_id":"A2C-EA1_disconnected_water_body","timestamp":"2024-01-01T00:00:00Z","track":"A"}
