{"case_version":"1.0.0","catalog_version":"0.1.0","certification_claims":["A-C"],"content_hash":"d0fdf43c95cc3ccd273f2bb7d758bc415193d6de6557952a1d454f21e5279bec","criteria_results":[{"detail":"final_stored_volume: simulated 285000 vs expected 285000 m3","gating":true,"id":"mass_conservation","metric":"expected_state_error","observed":2.655086287280969e-13,"passed":true,"threshold":{"op":"abs<=","units":"%","value":0.1},"variable":"volume"}],"passed":true,"schema_version":"1.0.0","signature":{"alg":"Ed25519","key_id":"benchmark1d2d-dev","value":"6nV1jphmfD4Aag/QNR3W2d5K+yTvLlShfobbgk77QHAsF/RnoHFGG4aV5hN4P9NB5s7UfLSwIvKNBqXt3eYiBA=="},"solver":{"adapter":"generic_parquet","name":"demo-swe2d (first-order FV, HLL + hydrostatic reconstruction) at 10 m (spec alternative resolution)","version":"0.1.0"},"test_id":"A2C-EA4_flood_propagation_speed","timestamp":"2024-01-01T00:00:00Z","track":"A"}
