{"case_version":"1.0.0","catalog_version":"0.1.0","certification_claims":["A-C"],"content_hash":"0c8b61b4457f75356bd62e97454597ebbd09e18b9c307d0bfccf34cbd9c49bc4","criteria_results":[{"detail":"final_stored_volume: simulated 9.45e+06 vs expected 9.45e+06 m3","gating":true,"id":"mass_conservation","metric":"expected_state_error","observed":0.0,"passed":true,"threshold":{"op":"abs<=","units":"%","value":0.1},"variable":"volume"}],"passed":true,"schema_version":"1.0.0","signature":{"alg":"Ed25519","key_id":"benchmark1d2d-dev","value":"D1GRIV6MPu+vihFQofZVBtZM2hHbxPx3bi759dUCIlpk9mSZF3vf5WLAARaiXUQm1sRGE8D/MiLWU7qE5qoNBw=="},"solver":{"adapter":"lisflood (dg2 solver, defaults; CPU, double precision)","name":"LISFLOOD-FP 8.3 DG2","version":"8.3"},"test_id":"A2C-EA5_valley_flooding","timestamp":"2024-01-01T00:00:00Z","track":"A"}
