{"case_version":"1.0.0","catalog_version":"0.1.0","certification_claims":[],"content_hash":"93c00be4a31faedbec6f9129ec31d99f215a799b50e75025a401edabeb062863","convergence_result":{"errors":[0.001431958464625736,0.0023321361445432145,0.003738254165552009,0.006174323633934223],"expected_order":1.0,"gci":1.2761932192122951,"min_observed_order":0.8,"norm":"L1","observed_order":0.6921875077405707,"passed":false,"spacings":[1.25,2.5,5.0,10.0],"variable":"h"},"criteria_results":[{"gating":true,"id":"L1_h","metric":"L1","observed":0.001431958464625736,"passed":true,"threshold":{"op":"abs<=","units":"m","value":0.05},"variable":"h"},{"gating":true,"id":"mass","metric":"global_mass_error","observed":-0.01599318170623032,"passed":true,"threshold":{"op":"abs<=","units":"%","value":0.1},"variable":"volume"}],"passed":false,"schema_version":"1.0.0","signature":{"alg":"Ed25519","key_id":"benchmark1d2d-dev","value":"zj0U7tWfwEpjWOnNpwMObwCW+wFRsflBCnmWtgDX+FUre8cSZnfrcCmXyzDpwFoUKqMcDnOR1cLM2kGCjjtwDg=="},"solver":{"adapter":"hydronet (fvm; HydroNet dam-break example settings, CFL 0.3; h_dry 0.0001 m)","name":"HydroNet finite volume (Roe, RK2) (0d98ff5)","version":"0d98ff5"},"test_id":"A1F-011_stoker_wet_bed_dambreak","timestamp":"2024-01-01T00:00:00Z","track":"A"}
