{"case_version":"1.0.0","catalog_version":"0.1.0","certification_claims":["A-V"],"content_hash":"138b5f7a4bd02f280ce8d4145bd57791b97d1f4ecca9f15c2a5613d73022f0ca","criteria_results":[{"gating":true,"id":"nodal_head","metric":"Linf","observed":0.007360044813310651,"passed":true,"threshold":{"op":"abs<=","units":"m","value":0.05},"variable":"h"},{"detail":"L2 error relative to the L2 norm of the reference","gating":true,"id":"link_flow","metric":"L2","observed":3.475464406757863e-06,"passed":true,"threshold":{"op":"abs<=","units":"%","value":0.1},"variable":"Q"}],"passed":true,"schema_version":"1.0.0","signature":{"alg":"Ed25519","key_id":"benchmark1d2d-dev","value":"ar04Y25iFEom+riLEosXt0/CsxR0N1+Y0TkdOXxKpAvQqiAqkcOccELxAncwdWTieV1PFJNnkv5dyeTp0eZgAA=="},"solver":{"adapter":"hydra CLI 4.1.1 (wds engine, EPANET-format binary output)","name":"Hydra 17.0.0 water distribution","version":"17.0.0/4.1.1"},"test_id":"A1P-010_todini_multiloop","timestamp":"2024-01-01T00:00:00Z","track":"A"}
