{"case_version":"1.0.0","catalog_version":"0.1.0","certification_claims":["A-V"],"content_hash":"84c70d901c24acc72099956418ee3f3bbb97b1c5edeb39b24ff8f88e2cc2af67","criteria_results":[{"detail":"head loss 3.1140 m vs exact 3.0938 m","gating":true,"id":"head_loss","metric":"relative_head_loss","observed":0.6522577644022983,"passed":true,"threshold":{"op":"abs<=","units":"%","value":1.0},"variable":"h"},{"gating":true,"id":"head_profile","metric":"L2","observed":0.011936169971714027,"passed":true,"threshold":{"op":"abs<=","units":"m","value":0.05},"variable":"h"}],"passed":true,"schema_version":"1.0.0","signature":{"alg":"Ed25519","key_id":"benchmark1d2d-dev","value":"3ztksiHVlnstFlcf8i0lRImkfGkDq6WlqxX2sTBWwieJ/DtUiPxz56LErX0Ks40usZAnbqeb3fHYXga42z1PBg=="},"solver":{"adapter":"hydra CLI 4.1.1 (wds engine, EPANET-format binary output)","name":"Hydra 17.0.0 water distribution","version":"17.0.0/4.1.1"},"test_id":"A1P-001_darcy_weisbach_single_pipe","timestamp":"2024-01-01T00:00:00Z","track":"A"}
