{"case_version":"1.0.0","catalog_version":"0.1.0","certification_claims":["A-C"],"content_hash":"57df411afaab45101ae6c903b499016c8bc0a6bb58f8619fc8c7e81e79ca914e","criteria_results":[{"detail":"final_stored_volume: simulated 285023 vs expected 285000 m3","gating":true,"id":"mass_conservation","metric":"expected_state_error","observed":0.008042028245614155,"passed":true,"threshold":{"op":"abs<=","units":"%","value":0.1},"variable":"volume"}],"passed":true,"schema_version":"1.0.0","signature":{"alg":"Ed25519","key_id":"benchmark1d2d-dev","value":"L3IEkm+kYn9VjojNgKocwcq/X6bX/ypSWkOkwz9r+Jqp7JZYj9hRVFFvS+HmqYmtPWZBLU7xWn+VYqhdxJ9VAw=="},"solver":{"adapter":"lisflood (fv1 solver, defaults; CPU, double precision)","name":"LISFLOOD-FP 8.3 FV1","version":"8.3"},"test_id":"A2C-EA4_flood_propagation_speed","timestamp":"2024-01-01T00:00:00Z","track":"A"}
