{"case_version":"1.0.0","catalog_version":"0.1.0","certification_claims":["A-V"],"content_hash":"39e762aa98c5bb769a8022e69a6e0f86898e381a9c1b3997e7fb8e52444b92fe","criteria_results":[{"gating":true,"id":"grade_line","metric":"Linf","observed":1.0994851606938028e-07,"passed":true,"threshold":{"op":"abs<=","units":"m","value":0.01},"variable":"h"},{"detail":"L2 error relative to the L2 norm of the reference","gating":true,"id":"pipe_flow","metric":"L2","observed":3.973642988726786e-06,"passed":true,"threshold":{"op":"abs<=","units":"%","value":0.5},"variable":"Q"}],"passed":true,"schema_version":"1.0.0","signature":{"alg":"Ed25519","key_id":"benchmark1d2d-dev","value":"cIDU3Y27uEG1jLLUJeNdtzlge4MGzKwnz1dBhCnZfCaH965HHjmdrRT6jeX9hjVgf0eJghbjO8+oUh8E2YrzBA=="},"solver":{"adapter":"swmm (DYNWAVE routing, network.json as a SWMM input file)","name":"Hydra urban drainage (17.0.0/4.1.1)","version":"17.0.0/4.1.1"},"test_id":"A1D-002_surcharged_pipe_grade_line","timestamp":"2024-01-01T00:00:00Z","track":"A"}
