{"case_version":"2.0.0","catalog_version":"0.1.0","certification_claims":[],"content_hash":"a279e49600b2ed8b8a6bd9941a11ddf75fa96bbb00be1663574f718e45586491","convergence_result":{"errors":[5.69244462403554e-05,6.766447885375893e-05,0.00012836481920814257,0.00039661853092708247],"expected_order":1.0,"gci":0.47011204341938373,"min_observed_order":0.8,"norm":"L1","observed_order":0.5865648009479199,"passed":false,"spacings":[0.012499999999999956,0.025000000000000022,0.050000000000000044,0.09999999999999998],"variable":"h"},"criteria_results":[{"gating":true,"id":"depth_L1","metric":"L1","observed":5.69244462403554e-05,"passed":true,"threshold":{"op":"abs<=","units":"m","value":0.02},"variable":"h"},{"gating":true,"id":"mass","metric":"global_mass_error","observed":-0.0007871156559973796,"passed":true,"threshold":{"op":"abs<=","units":"%","value":0.1},"variable":"volume"}],"passed":false,"schema_version":"1.0.0","signature":{"alg":"Ed25519","key_id":"benchmark1d2d-dev","value":"9yy2XgT+6XQo31Dncx6L6/ZEtRZtQHtRS4xoR7E4k7ZKunThv2G4qGRiDPPPyiHtOlLm3AFWd+cR6N63OJgiDQ=="},"solver":{"adapter":"lisflood (dg2 solver, defaults; CPU, double precision)","name":"LISFLOOD-FP 8.3 DG2","version":"8.3"},"test_id":"A2A-001_thacker_parabolic_bowl","timestamp":"2024-01-01T00:00:00Z","track":"A"}
