{"case_version":"2.0.0","catalog_version":"0.1.0","certification_claims":[],"content_hash":"5a7707655db41e264429da09b76c87e900170822e665d423dba5f44852cf62c3","convergence_result":{"errors":[0.0012741585905366932,0.0021235284539279572,0.0034120870480185373,0.005434048043148199],"expected_order":1.0,"gci":1.309273810095239,"min_observed_order":0.8,"norm":"L1","observed_order":0.710554798082428,"passed":false,"spacings":[1.25,2.5,5.0,10.0],"variable":"h"},"criteria_results":[{"detail":"front holding the last 5% of the water downstream of the dam: 1232.34 m vs exact 1237.39 m","gating":true,"id":"volume_front","metric":"volume_front_error","observed":-5.045971048888305,"passed":false,"threshold":{"op":"abs<=","units":"m","value":2.5},"variable":"h"},{"gating":false,"id":"front_position","metric":"front_position_error","observed":38.64785438002309,"passed":false,"threshold":{"op":"abs<=","units":"m","value":2.5},"variable":"h"},{"gating":true,"id":"mass","metric":"global_mass_error","observed":-9.016604195252992e-06,"passed":true,"threshold":{"op":"abs<=","units":"%","value":0.1},"variable":"volume"}],"passed":false,"schema_version":"1.0.0","signature":{"alg":"Ed25519","key_id":"benchmark1d2d-dev","value":"/xVWoHC+fb81PhIgWs7ODmaDHQ/UHA1N84XsJMy+OsuGTCxYIXEJMe4IJhXC+9No1Hqq8k5hVyAY04YMWohZCQ=="},"solver":{"adapter":"lisflood (fv1 solver, defaults; CPU, double precision)","name":"LISFLOOD-FP 8.3 FV1","version":"8.3"},"test_id":"A1F-010_ritter_dry_bed_dambreak","timestamp":"2024-01-01T00:00:00Z","track":"A"}
