{"case_version":"1.0.0","catalog_version":"0.1.0","certification_claims":[],"content_hash":"63a1518489323f9529e5d04b63a5d7e66fe4b878814c66fd1a7164b42091ce1e","convergence_result":{"errors":[0.6427952959526324,0.4356685414462138,0.426174167673584],"expected_order":1.0,"gci":-4.325650866055431,"min_observed_order":0.8,"norm":"L1","observed_order":-0.2964581118454333,"passed":false,"spacings":[0.050000000000000266,0.10000000000000009,0.19999999999999984],"variable":"h"},"criteria_results":[{"gating":true,"id":"L1_h","metric":"L1","observed":0.6427952959526324,"passed":false,"threshold":{"op":"abs<=","units":"m","value":0.005},"variable":"h"},{"gating":true,"id":"L1_Q","metric":"L1","observed":3.0271926308239054,"passed":false,"threshold":{"op":"abs<=","units":"m\u00b2/s","value":0.0153},"variable":"Q"}],"passed":false,"schema_version":"1.0.0","signature":{"alg":"Ed25519","key_id":"benchmark1d2d-dev","value":"mXB6H78DdEpL8kcazNJtyzxeYKWnyYvGjBFhCr3ozIPlAFk9e0+cK5qRg5MKcryYEC1eCATxXHQ5LYCPvds9Aw=="},"solver":{"adapter":"swmm (DYNWAVE routing, conduit per grid cell)","name":"Hydra urban drainage (17.0.0/4.1.1)","version":"17.0.0/4.1.1"},"test_id":"A1F-041_swashes_bump_transcritical","timestamp":"2024-01-01T00:00:00Z","track":"A"}
