{"case_version":"1.0.0","catalog_version":"0.1.0","certification_claims":[],"content_hash":"eebe46bd827b24413a7cdc1cf478dd9af25f10b0bf0af03041555804e062b431","criteria_results":[{"gating":true,"id":"Linf_u","metric":"Linf","observed":0.012325060553848743,"passed":false,"threshold":{"op":"abs<=","units":"m/s","value":0.001},"variable":"u"},{"gating":true,"id":"L1_h","metric":"L1","observed":0.0001197257065027931,"passed":true,"threshold":{"op":"abs<=","units":"m","value":0.0005},"variable":"h"},{"gating":false,"id":"Linf_h","metric":"Linf","observed":0.0010756464507429842,"passed":false,"threshold":{"op":"abs<=","units":"m","value":0.001},"variable":"h"}],"passed":false,"schema_version":"1.0.0","signature":{"alg":"Ed25519","key_id":"benchmark1d2d-dev","value":"jM/NoU7MwCl7R7TbXYWXcJN2OgiMuB+l4xYbNszuLKjCK3CZs1/yOjGgaPjntLZnMbP4B6azeWEIZz5krsalCw=="},"solver":{"adapter":"swmm (DYNWAVE routing, conduit per grid cell)","name":"Hydra urban drainage (17.0.0/4.1.1)","version":"17.0.0/4.1.1"},"test_id":"A1F-043_swashes_lake_at_rest_emerged_bump","timestamp":"2024-01-01T00:00:00Z","track":"A"}
