{"case_version":"1.0.0","catalog_version":"0.1.0","certification_claims":["A-C"],"content_hash":"ec15b25addf0a56a3707a6b664f98999891992bba91f452e61d50e2a6e9b13c2","criteria_results":[{"detail":"final_stored_volume: simulated 285003 vs expected 285000 m3","gating":true,"id":"mass_conservation","metric":"expected_state_error","observed":0.0008788239537623891,"passed":true,"threshold":{"op":"abs<=","units":"%","value":0.1},"variable":"volume"}],"passed":true,"schema_version":"1.0.0","signature":{"alg":"Ed25519","key_id":"benchmark1d2d-dev","value":"FBmJPbsXDj7WH5QywsnvQyz1Bq2JhJ1uEI62gm9uZxxApq1DQbYSDWUIAEpdsqcFKMmjtRtgfR9h0MIITeA+Ag=="},"solver":{"adapter":"hecras 2D (headless terrain + seeded mesh + boundary lines, SWE-ELM; depth = cell volume / area)","name":"HEC-RAS 6.6 2D SWE-ELM","version":"6.6"},"test_id":"A2C-EA4_flood_propagation_speed","timestamp":"2024-01-01T00:00:00Z","track":"A"}
