{"case_version":"2.0.0","catalog_version":"0.1.0","certification_claims":["B-2%"],"content_hash":"a417948feb6bdfa2b763ec46b4045c768851717de68eb55abc345719456b5d3d","criteria_results":[{"detail":"worst of 90 elements: 1 (+0 %)","gating":true,"id":"peak_depth","metric":"relative_peak","observed":0.0,"passed":true,"threshold":{"op":"abs<=","units":"%","value":2.0},"variable":"h"},{"detail":"worst of 96 elements: 10139+386 (+0 %)","gating":true,"id":"link_volume","metric":"relative_volume","observed":0.0,"passed":true,"threshold":{"op":"abs<=","units":"%","value":2.0},"variable":"Q"},{"detail":"worst of 96 elements: 10139+386 (+0 s)","gating":true,"id":"peak_timing","metric":"timing_error","observed":0.0,"passed":true,"threshold":{"op":"abs<=","units":"s","value":120.0},"variable":"Q"}],"passed":true,"schema_version":"1.0.0","signature":{"alg":"Ed25519","key_id":"benchmark1d2d-dev","value":"kJo4JnILqt5EaJuCOUUGBRtqmMrJbCWOv2ig3K1pRu0WX8zsAtun12AR4lRMXa9i9s4/hqu/lskVvcMeBZQnDA=="},"solver":{"adapter":"swmm5 (swmm-toolkit 0.10.0)","name":"EPA SWMM 5.1.15","version":"5.1.15"},"test_id":"B-RTC-001_pump_station_rules","timestamp":"2024-01-01T00:00:00Z","track":"B"}
