{"case_version":"2.0.0","catalog_version":"0.1.0","certification_claims":["A-V"],"content_hash":"3e450eb29dba848e6c3feb913831bf1288583ebbf723ca1a2d6118daa5ffd6bb","convergence_result":{"errors":[4.72478290109072e-05,9.199002358764973e-05,0.00016667921968067223,0.0003112788219426237],"expected_order":1.0,"gci":1.3478295442377848,"min_observed_order":0.8,"norm":"L1","observed_order":0.9093771527414916,"passed":true,"spacings":[0.012499999999999956,0.025000000000000022,0.050000000000000044,0.09999999999999998],"variable":"h"},"criteria_results":[{"gating":true,"id":"depth_L1","metric":"L1","observed":4.72478290109072e-05,"passed":true,"threshold":{"op":"abs<=","units":"m","value":0.02},"variable":"h"},{"gating":true,"id":"mass","metric":"global_mass_error","observed":-0.0001000696687316919,"passed":true,"threshold":{"op":"abs<=","units":"%","value":0.1},"variable":"volume"}],"passed":true,"schema_version":"1.0.0","signature":{"alg":"Ed25519","key_id":"benchmark1d2d-dev","value":"AtrgSc1bGz3wM5iPkxsxlWQRBzDrb7fL7i2QY8UrIGNKuisDcJEu/m0UC+vQyF/rKiNmJvtgn8nQN8qkbAU9Dg=="},"solver":{"adapter":"generic_parquet","name":"demo-swe2d (first-order FV, HLL + hydrostatic reconstruction)","version":"0.1.0"},"test_id":"A2A-001_thacker_parabolic_bowl","timestamp":"2024-01-01T00:00:00Z","track":"A"}
