{"case_version":"1.0.0","catalog_version":"0.1.0","certification_claims":["B-1%"],"content_hash":"25763f6e6928b32e40885bb16a55bc8e7b23a3b06daf82f3b5dce939c7b54856","criteria_results":[{"detail":"worst of 11 elements: 2 (-0.1134 %)","gating":true,"id":"peak_pressure","metric":"relative_peak","observed":-0.1133750495953749,"passed":true,"threshold":{"op":"abs<=","units":"%","value":1.0},"variable":"p"},{"detail":"worst of 13 elements: 21 (+0.09112 %)","gating":true,"id":"link_volume","metric":"relative_volume","observed":0.09112442417802911,"passed":true,"threshold":{"op":"abs<=","units":"%","value":1.0},"variable":"Q"},{"detail":"worst of 13 elements: 10 (+0 s)","gating":false,"id":"peak_timing","metric":"timing_error","observed":0.0,"passed":true,"threshold":{"op":"abs<=","units":"s","value":3600.0},"variable":"Q"}],"passed":true,"schema_version":"1.0.0","signature":{"alg":"Ed25519","key_id":"benchmark1d2d-dev","value":"w9FDsHrmasdz01er7bVntlnRcbckfCrhnwtwNOU/f9T1jijEl246Mlvre/Z1FCrMpRRZ7BtVxWYuf9agBQi6BA=="},"solver":{"adapter":"hydra CLI 4.1.1 (wds engine, EPANET-format binary output)","name":"Hydra 17.0.0 water distribution","version":"17.0.0/4.1.1"},"test_id":"B-EPANET-001_net1_parity","timestamp":"2024-01-01T00:00:00Z","track":"B"}
