{"case_version":"1.0.0","catalog_version":"0.1.0","certification_claims":["B-1%"],"content_hash":"0ac132ef2fdf57a6fb94037bd045716c8b9a26268be54a7aed7c1dd7228774ca","criteria_results":[{"detail":"worst of 11 elements: 10 (+0 %)","gating":true,"id":"peak_pressure","metric":"relative_peak","observed":0.0,"passed":true,"threshold":{"op":"abs<=","units":"%","value":1.0},"variable":"p"},{"detail":"worst of 13 elements: 11 (-1.614e-07 %)","gating":true,"id":"link_volume","metric":"relative_volume","observed":-1.6138678827957338e-07,"passed":true,"threshold":{"op":"abs<=","units":"%","value":1.0},"variable":"Q"},{"detail":"worst of 13 elements: 10 (+0 s)","gating":false,"id":"peak_timing","metric":"timing_error","observed":0.0,"passed":true,"threshold":{"op":"abs<=","units":"s","value":3600.0},"variable":"Q"}],"passed":true,"schema_version":"1.0.0","signature":{"alg":"Ed25519","key_id":"benchmark1d2d-dev","value":"okjCtlv2LtnTv29zWQyj1+zMavKuHkd1ZCHzrYJ7rZTz2AkPZ2aUEG7DeuaMgil2NvhjlKtm7oxbkvq7n6HIBg=="},"solver":{"adapter":"epanet (wntr libepanet2)","name":"EPANET 2.0","version":"2.00.12"},"test_id":"B-EPANET-001_net1_parity","timestamp":"2024-01-01T00:00:00Z","track":"B"}
