{"case_version":"1.0.0","catalog_version":"0.1.0","certification_claims":["A-V"],"content_hash":"c07140dfb4ce432c6d582d4cfed0d94f1357a2a1e825dde4d67982757348214e","convergence_result":{"errors":[0.0005058529908675894,0.00072013853660924,0.0017948899559174945,0.0025360382815581718],"expected_order":1.0,"gci":0.5992172951692171,"min_observed_order":0.8,"norm":"L1","observed_order":0.9135526576994826,"passed":true,"spacings":[1.25,2.5,5.0,10.0],"variable":"h"},"criteria_results":[{"gating":true,"id":"L1_h","metric":"L1","observed":0.0005058529908675894,"passed":true,"threshold":{"op":"abs<=","units":"m","value":0.05},"variable":"h"},{"gating":true,"id":"mass","metric":"global_mass_error","observed":-0.041557274358634974,"passed":true,"threshold":{"op":"abs<=","units":"%","value":0.1},"variable":"volume"}],"passed":true,"schema_version":"1.0.0","signature":{"alg":"Ed25519","key_id":"benchmark1d2d-dev","value":"+h7Se/UrxofhpNn1sEdYLeCaTvhCf/qnYYnBXDMLvSBOXQpbdaVqDl/ej/wbde7vxw34NK+CgDrXF/db6SRuAA=="},"solver":{"adapter":"geoclaw (uniform grid, stock example settings)","name":"GeoClaw 5.9.2","version":"5.9.2"},"test_id":"A1F-011_stoker_wet_bed_dambreak","timestamp":"2024-01-01T00:00:00Z","track":"A"}
